{
  "id": "spoons",
  "name": "Spoons",
  "aliases": [
    "Pig",
    "Donkey",
    "Tongue"
  ],
  "category": "matching-collecting",
  "players": {
    "min": 3,
    "max": 12,
    "ideal": 8
  },
  "decks": "1 standard deck (52 cards), jokers removed",
  "equipment": {
    "standard_decks": 1,
    "jokers": 0,
    "special_deck": null,
    "extra_deck_for_large_groups": false,
    "other": [
      "Spoons, one fewer than the number of players"
    ]
  },
  "setup": "Three players is the minimum and six or more is where the game comes alive; a dozen still works as long as everyone can reach the middle of the table. Take the jokers out.\n\nCount the players and put out one spoon fewer: five spoons for six players, seven for eight. Any small object does the job, forks or poker chips or sugar sachets, provided they are all alike and none of them sits closer to one player than another. Cluster them tightly in the exact centre of the table. Nobody gets to rest a hand beside them while waiting.\n\nChoose a dealer, shuffle, and deal four cards face down to each player. The dealer keeps the rest of the pack squared face down at their own right hand as a stock, and the dealer is the only person who ever draws from it. The player on the dealer's right is at the end of the chain and has nobody to pass to, so leave a clear space at their elbow for the discards that will pile up there.\n\nEveryone picks up and looks at their four cards. Sort them fast, because nobody is going to say go.",
  "play": "There are no turns. Once the table has looked at its cards the dealer starts drawing, and from then on everybody runs continuously at whatever speed they can manage.\n\nThe dealer takes the top card of the stock, is briefly holding five, keeps the four they want and pushes the odd one face down to the player on their left. That player picks it up, is briefly holding five, keeps four and passes one on, and so it travels round the circle. Two rules keep it honest: one card at a time, and never fewer than four or more than five in hand. You may not let a queue build up so you can sift through it at leisure, and you may not shove two cards at once onto a neighbour who is drowning.\n\nThe player at the end of the chain, on the dealer's right, discards face down onto their own pile instead of passing. Should the stock run dry before anyone has four of a kind, the dealer takes that discard pile, picks it up exactly as it lies without shuffling, since nobody has seen a card in it, and carries on drawing from it, so the circle never actually stops.\n\nWhat you are collecting is four of a kind. Four aces, four sevens, anything, and suits are irrelevant. The moment you have it, take a spoon. No announcement is required, and the entire art of the game is lifting one so smoothly that the table needs a second to catch up. As soon as any spoon leaves the middle, everyone may grab, regardless of what they are holding; you never need four of a kind to save yourself, only a spoon. One player ends up empty-handed, because the middle was one spoon short to begin with.\n\nThat player collects a letter, S on the first miss, then P, O, O, N, S. Complete the word and you are out. Every time somebody is eliminated, take a spoon out of the middle too, so the shortage stays at exactly one for the rest of the game.\n\nTwo situations come up often enough to be worth agreeing on before you deal. A player who grabs when no one has legitimately claimed a spoon takes the letter themselves, which is the standard cure for twitchy hands. And a spoon that has been touched and lifted belongs to whoever lifted it: no wrestling it back, however marginal the grab looked.\n\nOne deal is one round, and everything stops the moment the middle is bare: no more drawing, no more passing, whatever anyone is holding. Gather every card up, including the stock and the discard pile, shuffle the lot, deal four fresh cards each, and pass the deal one place to the left, skipping anyone who has already been knocked out.",
  "goal_and_scoring": "You are not really trying to win rounds, you are trying not to lose them. Assembling four of a kind guarantees you a spoon, but the far more common way to survive a round is simply to react quickly when somebody else does.\n\nThe scoring is the word itself, one letter for each round you finish empty-handed, and elimination on completing it. Six lives makes a long game with a big group: every round hands out exactly one letter, so eight players takes at least forty-two rounds, seven of them having to collect six letters apiece before the last one is standing. That is usually what you want at a party. Shorten it by using a shorter word, or drop the letters entirely and knock out the first player to miss.\n\nThe last player still holding letters to spare wins. What everybody actually remembers afterwards is not the winner but whoever was caught staring at a pair of kings while the middle of the table quietly emptied.\n\nThe players who last are rarely the fastest; they are the ones taking in the spoons and their own hand at the same time. Reading faces works too, which is the argument for gathering your four of a kind slowly and with a bored expression rather than pouncing on it.",
  "variants": [
    {
      "name": "Pig, Donkey and Tongue",
      "description": "Play with no props at all. Instead of taking a spoon, a player completing four of a kind gives an agreed silent signal: a finger on the nose in Pig, hands held up beside the head as ears in Donkey, a stuck-out tongue in Tongue. Everyone else copies as soon as they notice, and the last to react loses a life, traditionally three lives in Pig and six in Donkey. Nothing can be knocked over or fought for, so this is the version for a car, a train or a small table, and it opens up the option of signalling when you have nothing."
    },
    {
      "name": "No stock, everyone passes at once",
      "description": "Strip the pack down to exactly four cards per player, four ranks for four players and so on, and deal the whole thing out. There is no stock and no dealer advantage: on a signal, every player slides one unwanted card face down to their left and picks up the one arriving from the right, then does it again, as fast as the group can go. When a player is knocked out, remove a spoon and one rank's worth of cards together so the arithmetic stays right. This is the older shape of the game and the one usually printed under the name Pig."
    },
    {
      "name": "Sudden death",
      "description": "Forget the letters. Whoever fails to get a spoon is out on the spot, and a spoon comes off the table with them. A game with eight players is over in six or seven quick rounds, which suits a group that wants the game as a filler rather than the evening's entertainment. It also raises the stakes on every single grab, since there is no cushion for one lapse of attention."
    },
    {
      "name": "Two packs for a crowd",
      "description": "There are only thirteen ranks, so a very large group runs out of sets. Shuffle two packs together, deal four each as usual, and let a set be any four cards of the same rank, duplicates included. Beyond fixing the arithmetic it also puts more live ranks in circulation, so rounds end faster, which matters when a big circle can take a while to get a card all the way round."
    }
  ],
  "difficulty": "simple",
  "duration_minutes": "15-45",
  "tags": [
    "kids",
    "family-friendly",
    "party",
    "large-group",
    "speed",
    "reflex",
    "beginner-friendly",
    "luck",
    "classic"
  ],
  "sources_consulted": [
    "Pagat",
    "Bicycle Cards",
    "Wikipedia",
    "Game Rules",
    "Gambiter",
    "Official Game Rules",
    "Classic Games and Puzzles"
  ]
}
