{
  "id": "go-fish",
  "name": "Go Fish",
  "aliases": [
    "Fish"
  ],
  "category": "matching-collecting",
  "players": {
    "min": 2,
    "max": 6,
    "ideal": 4
  },
  "decks": "1 standard deck (52 cards), jokers removed",
  "equipment": {
    "standard_decks": 1,
    "jokers": 0,
    "special_deck": null,
    "extra_deck_for_large_groups": false,
    "other": []
  },
  "setup": "Use a standard 52-card deck with the jokers out. Suits do not matter at any point; only rank does. Two to six can play, and four is a good number.\n\nChoose a dealer however you like. The deal passes to the left between games. Deal one card at a time, clockwise.\n\nHow many cards each player gets depends on the size of the table. With two or three players, deal seven each. With four or more, deal five each. The smaller hand keeps enough cards in the middle to fish from once the table gets crowded.\n\nSpread the undealt cards face down in a loose pile in the centre. This is the pool, also called the pond or the ocean. Keep it spread out rather than squared up so everyone can reach it without knocking it over.\n\nPick your hand up and sort it by rank so you can see what you already hold. Some groups have everyone lay down any complete book of four they were dealt before the first turn; others require you to wait until you have taken a turn. Either is fine, so long as you agree first. Play starts with the player to the dealer's left.",
  "play": "Turns pass clockwise. On your turn you ask one specific opponent, by name, for one specific rank. Say who you are asking and what you want: \"Priya, do you have any sevens?\"\n\nTwo restrictions govern the ask. You must already hold at least one card of the rank you name, so you can only ask for sevens if there is a seven in your hand. And you must direct the question at a single named player, not at the table in general.\n\nIf the player you asked holds any cards of that rank, they must hand over every one of them, not just one. You add them to your hand and your turn continues: ask again, of anyone at the table, for any rank you now hold. A good run can strip several opponents in one turn.\n\nIf the player you asked has none of that rank, they say \"Go fish.\" You draw the top card of the pool. If it happens to be the very rank you just asked for, show it to the table and take another turn. Otherwise you keep the card quietly and your turn ends, passing to the player on your left.\n\nWhenever you complete a book, meaning all four cards of one rank, lay it face up in front of you straight away. Completing a book does not end your turn and does not earn you an extra one; carry on with whatever you were doing. Cards in a laid-down book are out of play and cannot be asked for.\n\nIf your hand runs empty while the pool still has cards, refill it straight away: take five, or whatever is left if fewer than five remain. Do this the moment your last card leaves your hand, so if it empties in the middle of your own turn you draw and carry on asking without a break. Some groups have you draw only one card in that situation, which is harsher but keeps the pool alive longer; settle it before you start. If your hand is empty and the pool is empty as well, you are out, and the remaining players carry on without you. You can only put a question to a player who is actually holding cards, so anyone who is out is skipped from then on.\n\nOne detail worth agreeing up front: if you ask a question and the pool is already empty, there is nothing to fish for, so a \"go fish\" answer simply ends your turn.\n\nThe game finishes when all thirteen books have been laid down. Since a book is four cards and the deck holds thirteen ranks, that accounts for every card, and there is nothing left to hold or draw.",
  "goal_and_scoring": "You are collecting books, and a book is four cards of the same rank. Suits are irrelevant. The player with the most books when all thirteen have been made wins.\n\nThere is no point scoring beyond counting books. Seven books wins outright, but nobody usually gets that far in a full table. If two or more players tie for the most books, they share the win, or you can play a decider hand.\n\nEmptying your hand first is not a win condition and carries no reward. A player who runs out early has simply stopped being a target, which is often a disadvantage, because holding cards is what lets you keep asking.\n\nThe skill in the game is memory. Every question tells the table what you hold and what you were missing, and every handover tells them what you just gained. Track who asked for what, and go after players you know are sitting on a rank you need.",
  "variants": [
    {
      "name": "Ask for the exact card",
      "description": "Instead of naming a rank, you name a single card by rank and suit, such as the nine of clubs. You still have to hold at least one card of that rank to ask. The tighter target means far fewer successful requests, so hands last longer and remembering exactly which cards have surfaced matters much more. This is the older parlour game Authors, which Go Fish descends from and which is still sometimes used as another name for it."
    },
    {
      "name": "The blocker plays next",
      "description": "When someone tells you to go fish, the turn moves to them rather than to the player on your left. Turn order becomes unpredictable, which stops players from timing their questions around a fixed rotation, and it rewards answering \"go fish\" honestly and fast. Widely played as a house rule and worth agreeing on before the deal, since it changes the flow completely."
    },
    {
      "name": "No requirement to hold the rank",
      "description": "Drop the rule that you must already hold a card of the rank you ask for. Young children find the restriction hard to police and hard to remember, and removing it lets them fish for anything they fancy. It weakens the memory element considerably, because a question no longer tells the table anything about your hand."
    },
    {
      "name": "Pairs instead of books",
      "description": "Collect pairs of matching rank rather than sets of four, laying each pair down as you make it. There are twenty-six pairs in the deck instead of thirteen books, so cards leave hands much faster and a game finishes in a few minutes. This is the usual simplification for players too young to hold a large hand or keep track of four-card sets."
    },
    {
      "name": "Happy Families and other purpose-made decks",
      "description": "Dedicated illustrated packs replace ranks with themed sets, most famously the Victorian English game Happy Families, whose deck has eleven families of four members each. Play is identical, but matching by picture rather than by rank makes it accessible to children who cannot yet read card ranks. Many modern children's Go Fish decks work the same way."
    }
  ],
  "difficulty": "simple",
  "duration_minutes": "10-20",
  "tags": [
    "kids",
    "family-friendly",
    "classic",
    "beginner-friendly",
    "memory",
    "quick",
    "travel",
    "luck"
  ],
  "sources_consulted": [
    "Pagat",
    "Bicycle Cards",
    "Wikipedia",
    "Geeky Hobbies",
    "Ducksters",
    "Solitaire Paradise"
  ]
}
