{
  "id": "bs",
  "name": "BS",
  "aliases": [
    "Cheat",
    "I Doubt It",
    "Bullshit",
    "Bluff",
    "Doubt It"
  ],
  "category": "bluffing",
  "players": {
    "min": 2,
    "max": 10,
    "ideal": 5
  },
  "decks": "1 standard deck (52 cards), jokers removed; 2 decks shuffled together for six or more players",
  "equipment": {
    "standard_decks": 1,
    "jokers": 0,
    "special_deck": null,
    "extra_deck_for_large_groups": true,
    "other": []
  },
  "setup": "Take the jokers out. One pack handles up to about five players comfortably. From six up, shuffle two packs together, which also raises the number of cards you can claim at once from four to eight.\n\nTwo can play, but the game is thin at that size: with only one opponent you know exactly where every card you do not hold must be, and there is almost nothing to hide. Four to six is where it works.\n\nPick a dealer any way you like; the deal passes to the left afterwards. Deal the entire pack out one card at a time, clockwise, until nothing is left. Hands will not come out even unless the player count divides into 52, and that is fine: a one-card difference has no effect. With four players everyone starts with thirteen.\n\nPick your cards up and sort them by rank. You want to be able to see at a glance how many of each rank you hold, because the whole game is a running calculation of what you can honestly play and what you will have to fake.\n\nLeave the middle of the table clear for the discard pile. It starts empty and can grow to most of the deck.\n\nThe player to the dealer's left goes first and must claim aces. A common alternative is that whoever was dealt the ace of spades leads instead, again claiming aces. Either works; just say which one you are using before the first card goes down. Play runs clockwise.",
  "play": "Ranks are claimed in a fixed ascending cycle: ace, 2, 3, 4, 5, 6, 7, 8, 9, 10, jack, queen, king, then back to ace and around again. The cycle belongs to the table, not to any player. Whatever rank the previous player claimed, you claim the next one up.\n\nOn your turn, place one to four cards face down on the pile, or one to eight in a two-pack game, and say out loud how many and of what rank, for example \"two nines\". The rank is dictated by the sequence. The number is up to you, and so is whether the cards are actually what you said. You may play any cards you like under any claim.\n\nYou must play at least one card. You cannot pass and you cannot play zero. This is the engine of the game: sooner or later the sequence reaches a rank you hold none of, and you have to lie.\n\nWith a single pack the ceiling is four cards, since there are only four of each rank. With two packs it is eight. Claiming more than the pack allows is itself a giveaway.\n\nOnce your cards are down, any other player may challenge by calling \"BS!\" (or \"Cheat!\" or \"I doubt it!\"). The window stays open until the next player's cards hit the table, at which point the claim stands for good. Only one challenge is ever resolved, and it is the earliest one. Two people calling half a second apart is settled by ear. For a genuine dead heat there is no authoritative ruling anywhere, so pick a tie-break before you deal; the usual one is that the call from whoever sits nearest the challenged player's left is the one that stands.\n\nA challenge is resolved by turning over only the cards that were just played, not the whole pile:\n\n- If every one of them matches the claimed rank, the claim was honest and the challenger was wrong. The challenger takes the pile.\n- If even one card is not the claimed rank, the player who played them takes the pile.\n\n\"The pile\" means every card in the middle, including the cards that were just turned face up, and all of it goes into the losing player's hand. The rest of the pile is never exposed, so only the cards from the challenged play become public knowledge.\n\nEither way the pile is now gone from the table and the next player starts a fresh pile. Picking up does not cost you anything else, and it does not skip anyone.\n\nA challenge does not reset the rank cycle and does not change whose turn is next. Play carries on with the player to the left of whoever just played, claiming the next rank up, no matter who ended up with the pile. If the last claim was eights, the next claim is nines even if the eights turned out to be garbage and their owner is now holding twenty cards.\n\nIf nobody challenges, nothing is revealed. The cards stay face down on the pile and their true identity is never learned, which is exactly what makes the game work: a successful lie is invisible.\n\nGoing out has one wrinkle. Playing your last cards does not finish you immediately; you are only out once the challenge window has closed. If someone calls BS on your final play and you were lying, you take the pile and you are back in the game with a fistful of cards. If you were telling the truth, the challenger takes the pile and you have won. If nobody calls, you are out and the game ends there.",
  "goal_and_scoring": "You are trying to empty your hand. The first player to get rid of every card, and survive any challenge to that last play, wins.\n\nThere is no point scoring at all. A game is a single deal and takes as long as it takes.\n\nMany groups do not stop at the winner. Once someone is out, the rest keep going and note the order in which they finish; whoever is left with the only unplayed hand at the end takes last place. Anyone who has already finished is passed over on later circuits, and the rank sequence continues from wherever the last claim left it rather than starting over. Ranking the whole table this way keeps the people still in it invested after the first person leaves, and it turns second-to-last into an outcome worth chasing rather than a consolation.\n\nA few practical points that decide games. Lie small: claiming one card is far less suspicious than claiming four, and it also costs you less to be caught early when the pile is short. Watch the pile size, because a challenge is only worth making when the pile is small or when you are certain. And count: if you hold three queens yourself, anyone claiming three queens is caught before they finish the sentence.",
  "variants": [
    {
      "name": "Free choice of rank (Bluff)",
      "description": "Instead of a fixed ascending cycle, the player who starts a pile names any rank they like, and every player after them must claim that same rank until a challenge happens. Whoever ends up taking the pile starts the next one with a rank of their own choosing. This removes the forced-lie pressure of the ascending version, since you can open on a rank you actually hold, but it makes reading other players harder because nobody is ever obliged to lie. This is the version usually meant by the names Bluff and I Doubt It in older books."
    },
    {
      "name": "Up or down",
      "description": "You may claim either the next rank above or the next rank below the previous claim. After \"two tens\" the next player may claim nines or jacks. Some groups also allow repeating the same rank, which gives you three choices every turn. It makes honest play much easier, so lies become rarer and correspondingly more valuable, and it kills the standard tactic of counting ahead to work out which rank will land on you."
    },
    {
      "name": "Restricted challenge window",
      "description": "Rules differ on who may call and for how long. The most common version lets any player call until the next player's cards touch the pile. A tighter house rule allows only the player to the immediate left of the one who played, which keeps the game fast and stops the whole table ganging up. A looser one lets anyone call at any point before the pile is next collected, so a claim can be caught several turns later. Settle this before dealing; it is the single most argued-about rule in the game."
    },
    {
      "name": "Extra penalty for a bad call",
      "description": "A wrong challenger takes the pile and additionally draws a card from the hand of the player they falsely accused, or from every player at the table. This clamps down on speculative calls made purely to keep the pile small, and it makes challenging a real decision rather than a free option. Groups that find their games stalling because everyone calls constantly usually add some version of this."
    },
    {
      "name": "Restart the cycle after a pickup",
      "description": "In the standard game a challenge changes nothing about the sequence: the next claim is one rank above the last one made, whoever ended up with the pile. A widespread house rule instead restarts the cycle at aces whenever a pile is collected, with the player to the left of whoever took it leading. It makes the game longer, because low ranks come round again and again, and it hands a small advantage to anyone holding aces and twos at the moment a challenge lands. Decide which of the two you are playing before the first card goes down."
    },
    {
      "name": "Two-pack table",
      "description": "For six or more players, shuffle two 52-card packs together. Everyone still gets roughly the same hand size, but each rank now has eight copies, so claims of five, six or more are legal and the arithmetic of catching a liar changes completely. Holding three of a rank no longer proves much. Piles grow much larger, which makes getting caught genuinely punishing."
    }
  ],
  "difficulty": "simple",
  "duration_minutes": "15-30",
  "tags": [
    "bluffing",
    "party",
    "family-friendly",
    "classic",
    "quick",
    "beginner-friendly",
    "large-group"
  ],
  "sources_consulted": [
    "Pagat",
    "Bicycle Cards",
    "Wikipedia",
    "Official Game Rules",
    "Game Rules",
    "Denexa Games",
    "PlayingCardDecks",
    "Gambiter"
  ]
}
