{
  "id": "war",
  "name": "War",
  "aliases": [
    "I Declare War",
    "Battle",
    "Bataille"
  ],
  "category": "matching-collecting",
  "players": {
    "min": 2,
    "max": 4,
    "ideal": 2
  },
  "decks": "1 standard deck (52 cards), jokers removed",
  "equipment": {
    "standard_decks": 1,
    "jokers": 0,
    "special_deck": null,
    "extra_deck_for_large_groups": false,
    "other": []
  },
  "setup": "Take a 52-card deck and remove the jokers. Shuffle well and deal the whole pack out face down, one card at a time, so that each player has an equal stack. With two players that is 26 cards each; with three, deal 17 each and set the odd card aside so the stacks are level; with four, 13 each.\n\nNobody looks at their cards at any point. Keep your stack squared up face down in front of you, and leave a clear space in the middle of the table where cards will be turned up.\n\nAgree before the first battle on where won cards go, because the two usual methods behave differently. Either slide everything you win straight underneath your face-down stack, so you play from a single pile all game, or keep a separate face-down winnings pile beside it and only turn that pile over once your playing stack is exhausted. Whichever you choose, give the won cards a shuffle before they re-enter play; the reason is in the play section and it matters more than it sounds.\n\nRanking is the usual one with aces high: A, K, Q, J, 10, 9, 8, 7, 6, 5, 4, 3, 2. Suits are irrelevant from start to finish. There is no dealer advantage and no first player, because everybody acts at the same moment, so choosing who deals is purely a matter of convenience, and if you play several games in a row anyone may deal the next one.",
  "play": "Play is a series of battles. On each battle every player takes the top card of their stack and turns it face up in the middle at the same time. Whoever turned up the highest rank collects every card on the table and adds it face down to their own cards, using whichever of the two methods you settled on in setup. Suits never break a tie and never matter.\n\nWhen the two highest cards are equal, that is a war. Each tied player puts three cards face down on top of the pile they are contesting, then turns one more card face up. The higher of the new face-up cards takes everything: in a two-player war that is ten cards, the two originals plus eight more.\n\nIf the face-up cards of the war are also equal, the war simply repeats. Each player again lays three down and one up, adding another eight cards to the pot, and again the higher card takes the lot. There is no cap on this. A second round is often called a double war and a third a triple war, and while three or four consecutive ties are rare, nothing in the rules stops the sequence from continuing.\n\nPublished rule sets differ on how many cards go face down, and both forms are in wide use. Three down and one up, often chanted as I-de-clare-war while the cards are dealt, is the version most people learn as children. Several standard references instead give a shorter form of a single card face down and a single card face up, which puts six cards at stake in a two-player war instead of ten and is noticeably quicker. Settle which one you are using before the first tie, since it changes how abruptly stacks change hands.\n\nRunning short of cards mid-war is the edge case that causes arguments. The usual ruling is that you put down as many face-down cards as you can spare and turn your very last card face up as your fighting card; if you have exactly one card left, that card is your face-up card and there are no face-down cards at all. A player who cannot produce a single card has lost. Some groups play the stricter version where failing to complete a full war loses the game outright.\n\nWhen you play the last card of your face-down stack, pick up the cards you have won, shuffle them, and carry on with them as your new stack. If instead you have been putting winnings straight under your stack, shuffle each batch as you add it. The shuffling is not tidiness. War has no decisions in it, so a deal plus a fixed rule for returning won cards determines the whole game: if the cards always go back in the same order, a deal can enter a cycle in which the same sequence of battles repeats forever and neither player ever wins. Randomising the returned cards breaks any such cycle, and the game then ends with probability one.\n\nWith three or four players everyone flips at once and the highest card takes the whole table. Where the highest card is tied, only the players holding it fight the war; anyone who was beaten leaves their card in the pot and takes no further part in that battle. A player whose cards are gone is out, and the rest continue until one player holds everything.",
  "goal_and_scoring": "You win by taking every card in the deck. There is no scoring, no tricks to count and nothing to write down. No player ever makes a decision either: once the pack is dealt, the result depends only on the order of the cards and on how won cards are put back, so there is no way to play the game well or badly.\n\nBecause cards keep circulating, a game can run far longer than beginners expect. Fifteen to thirty minutes is typical, but an hour is entirely possible, and a game between two evenly matched stacks can churn without either side making progress.\n\nMost households therefore cap it. Play for a set time, or a set number of battles, and whoever holds the most cards at that moment wins. Counting is quick because the totals always add up to 52. Another common cap is to play three wars and stop, or to declare a win as soon as one player is reduced below some agreed number of cards.",
  "variants": [
    {
      "name": "One card down, one card up",
      "description": "On a tie each player buries only a single card face down before turning up the deciding card, so six cards are at stake in a two-player war rather than ten. This is the form printed by several standard references and it shortens the game noticeably, since fewer cards are locked into each contested pot and players run their stacks down less abruptly. Repeated ties are handled the same way, one down and one up each time."
    },
    {
      "name": "Casino War",
      "description": "The banked table-game version, played against a dealer. You bet, then you and the dealer each get one card and the higher card wins even money. On a tie you choose: surrender and forfeit half your stake, or go to war by matching your original bet, after which the dealer burns three cards and deals one more to each of you. Beating or tying the dealer on that second card wins even money on the raise while the original bet pushes. Where it is offered, a second tie pays a bonus, commonly equal to the original wager, but plenty of tables do not offer it at all. Most tables also carry an optional side bet that the first two cards will tie, typically paying 10 to 1."
    },
    {
      "name": "Three or more players",
      "description": "Deal the pack out as evenly as possible, setting aside any remainder, and have everyone turn a card at the same time. The highest card sweeps the table. If two or more players tie for the lead, only the tied players fight the war, and cards already beaten stay in the pot as spoils for the eventual winner. Players drop out as their cards run out and the last one standing wins. Four players with two decks shuffled together keeps the same feel with more cards in motion."
    },
    {
      "name": "Timed War",
      "description": "Set a timer, often ten or fifteen minutes, and play until it goes off. Whoever holds more cards at that point wins. This is the standard fix for the game's biggest flaw with young children, since it guarantees an ending and gives a clear result without anyone having to concede a stalemate that could otherwise go on indefinitely."
    },
    {
      "name": "Jokers wild",
      "description": "Leave both jokers in the deck and rank them above the ace, so a joker beats every other card in the pack. With 54 cards the two-player deal is 27 apiece and the three-player deal is 18 apiece with no card left over. The two jokers are equal to each other, so if they meet you fight an ordinary war over them. Jokers make the sweeps more dramatic without adding any decisions, which is the whole appeal for younger players."
    }
  ],
  "difficulty": "simple",
  "duration_minutes": "15-45",
  "tags": [
    "kids",
    "family-friendly",
    "classic",
    "luck",
    "two-player",
    "beginner-friendly",
    "travel"
  ],
  "sources_consulted": [
    "Pagat",
    "Wikipedia",
    "Bicycle Cards",
    "Dice Game Depot",
    "Geeky Hobbies",
    "Gamerules.com",
    "Wizard of Odds",
    "Card Game Wiki"
  ]
}
