{
  "id": "slapjack",
  "name": "Slapjack",
  "aliases": [
    "Slap Jack",
    "Slap-Jack"
  ],
  "category": "matching-collecting",
  "players": {
    "min": 2,
    "max": 8,
    "ideal": 4
  },
  "decks": "1 standard deck (52 cards), jokers removed; 2 decks shuffled together for six or more players",
  "equipment": {
    "standard_decks": 1,
    "jokers": 0,
    "special_deck": null,
    "extra_deck_for_large_groups": true,
    "other": []
  },
  "setup": "Take the jokers out and clear a hard, flat surface everyone can reach. Two to eight can play. Three or more is better than two, because with two players the pile bounces back and forth and a game can run a long time.\n\nChoose a dealer however you like; it matters very little, since nothing about the deal is an advantage, and pass the deal to the left if you play again. Deal the entire pack out one card at a time, face down, clockwise, until every card is gone. Hands do not need to come out even. With five players two people simply start with an extra card.\n\nNobody looks at any card, including their own. Square your cards into a tidy face-down stack in front of you. Keep it squared throughout: you play off the top and put winnings on the bottom, and a spilled stack costs you slaps.\n\nLeave the centre of the table clear. That is where the pile builds, and it needs to be within slapping distance of every player, so push chairs in and get elbows off the table before you start.\n\nThe player to the dealer's left turns the first card, and play runs clockwise from there.",
  "play": "On your turn, lift the top card off your own stack and drop it face up in the middle of the table, on top of whatever is already there. Turn it away from you, holding the far edge, so that everybody sees the face at the same instant. Peeking at your own card before you play it, or turning it toward yourself, is the standard way to cheat at this game and is treated accordingly.\n\nAlmost every card does nothing. You turn it, and the turn passes to the player on your left. The pile just grows.\n\nWhen a jack appears, everyone races to slap the pile. The first hand flat on the pile takes the whole thing: gather it up, square it, add it face down to the bottom of your stack, and shuffle your stack if you like. That player then turns the first card of a new pile, and play continues clockwise from them. There are only four jacks in the pack, so piles can get big before one shows up.\n\nIf two or more hands land at what looks like the same moment, the bottom hand wins, meaning the one actually touching the cards rather than the back of somebody else's hand. If it is genuinely too close to call, do not split the pile: leave it in the middle exactly as it is, and let the player to the left of whoever turned the jack carry on turning cards onto it. The pile then goes to whoever wins the next jack.\n\nA slap that lands on anything other than a jack costs you a card. Settling up works like this: whoever turned the card you wrongly hit is owed compensation, so you slide one card off the top of your own stack, sight unseen, over to them, and it goes underneath what they already hold. Where that forfeit ends up is the part people get wrong. It never goes into the centre for the next pile-winner to scoop up, which means a careless hand hands a measurable edge to one named opponent, and against somebody who swings at everything that trickle decides whole games. There is one hole in the rule, so patch it before you deal: a player who slaps a non-jack that came off their own stack owes a card to nobody in particular, and the simplest convention is to send it to their left-hand neighbour.\n\nWhen you turn your last card you are not out yet. You stay at the table and you may still slap, so the very next jack is your way back: win that slap and the entire pile becomes your new stack. Miss it, meaning the pile is claimed by someone else while you have no cards, and you are out for good. You get exactly one chance, not an open invitation to keep slapping all game. While you are waiting on it you are skipped in the rotation, since you have nothing to turn; the turn passes to the next player who still has a stack.\n\nA player who is out takes no further part. Their cards are already in circulation, so nothing needs to be redistributed and play carries on around the shrinking table.\n\nOne detail worth settling before you deal: a player with no cards who slaps a non-jack has nothing to hand over. The usual ruling is that they are simply out on the spot, having spent their one chance on the wrong card.\n\nPlay continues, jack by jack, until only one player is left holding cards.",
  "goal_and_scoring": "You are trying to finish holding every card in play: 52 with one pack, 104 if you dealt two. There is no scoring, no rounds and no partial credit. A player who has been knocked out is out, and the last player still holding cards has by definition collected the lot.\n\nA full game does take a while, especially with two players, because a large stack is not safe. One badly judged slap or one missed jack transfers a big pile and swings the whole game. Expect the lead to change hands several times.\n\nIf you want a guaranteed finish time, agree a stopping point before you start. Two common ones: play for a set fifteen or twenty minutes and give the win to whoever has the tallest stack, or play until the table is down to two and declare the larger stack the winner.\n\nSpeed matters less than people assume. What actually wins is watching the pile rather than your own hand, keeping your slapping hand hovering rather than resting, and not slapping at kings and queens, which at a glance look like jacks and account for most wasted cards.",
  "variants": [
    {
      "name": "More slappable cards",
      "description": "Add extra triggers to the jack: a double, meaning the top two cards match in rank, and a sandwich, meaning two matching cards with exactly one card between them. Piles change hands far more often and the game finishes sooner. Keep piling on triggers and you arrive at Egyptian Ratscrew, which is the same idea with a longer pattern list and face-card challenges bolted on."
    },
    {
      "name": "Harsher false-slap penalty",
      "description": "Instead of one card to the player who turned the card, a false slapper gives one card face down to every other player. On a full table that is a serious hit and it cures compulsive slapping in about two rounds. A gentler version used with young children replaces the card penalty with a warning and only starts taking cards on the second offence."
    },
    {
      "name": "Slap and call",
      "description": "You must shout \"jack\" as you slap. Hitting the pile silently does not count, and calling \"jack\" when the top card is not one costs a card whether or not your hand landed. It slows the reflex race down slightly and gives a clear tiebreaker when two hands arrive together, since the caller is easier to judge than the hand."
    },
    {
      "name": "Two packs for a big table",
      "description": "For six or more players, shuffle two 52-card packs together and deal them all out. Eight jacks in the pack instead of four means piles turn over about twice as often, which keeps a large table from sitting through long stretches of nothing. Every other rule stays the same, and the winner still needs every card in play."
    }
  ],
  "difficulty": "simple",
  "duration_minutes": "10-30",
  "tags": [
    "kids",
    "family-friendly",
    "speed",
    "reflex",
    "classic",
    "beginner-friendly",
    "quick",
    "luck"
  ],
  "sources_consulted": [
    "Bicycle Cards",
    "Pagat",
    "Wikipedia",
    "Game Rules",
    "Official Game Rules",
    "PlayingCardDecks",
    "Learning Board Games"
  ]
}
